"","Name","Price","Rating","Reviews"
"1","GzacDeope","$19.99","40","4.7 out of 5 stars"
"2","I Paused My Game to Be Here Hat for Men Women, Funny Adjustable Cotton Embroidered Gamer Baseball Cap  ","$21.99","399","4.6 out of 5 stars"
"3","swqfzki","$17.99","26","4.6 out of 5 stars"
"4","Gamer Hat Snapback Flat Bill Baseball Cap Men's Adjustable Gamers Gift Trucker Hats  ","$17.99","34,161","4.7 out of 5 stars"
"5","KUBILA","$16.99","85","4.6 out of 5 stars"
"6","Gamer Baseball Cap Gamers Gift Trucker Hats for Big Boy Girl  ","$17.99","1,570","4.7 out of 5 stars"
"7","Carhartt","$19.99","332","4.7 out of 5 stars"
"8","Men's Canvas Cap  ","$21.99","6","4.7 out of 5 stars"
"9","Shenbors","$21.99","33","4.5 out of 5 stars"
"10","Embroidered Baseball Hats for Men Women  ","$19.99","703","4.7 out of 5 stars"
"11","GOAUS","$19.99","155","4.5 out of 5 stars"
"12","Gamer Gifts,Socks Beanie Hat Baseball Cap, Valentines Day Gifts for Teen Boys Men Teenagers Kids Him  ","$9.99","109","4.4 out of 5 stars"
"13","Controller Gear","$24.95","10,064","4.7 out of 5 stars"
"14","Unisex-Adult's Super Mario Piranha Tube Snapback Flat Bill Hat, Black/Red, OSFM  ","$8.99","5","4.4 out of 5 stars"
"15","Ddsss","$11.99","9","4.7 out of 5 stars"
"16","Gaming Bucket Hat, Gamepad Gamer Fisherman Cap for Women Men, Video Game Unisex Packable Beach Sun Hat for Travel Outdoor  ","$8.99","11","4.5 out of 5 stars"
"17","Concept One","$10.90","7","5.0 out of 5 stars"
"18","Microsoft Xbox Baseball Hat, Glow in The Dark Skater Adult Snapback Cap with Flat Brim, Green/Black, One Size  ","$14.99","674","4.3 out of 5 stars"
"19","Ann Arbor T-shirt Co.","$15.99","55","4.5 out of 5 stars"
"20","I Paused My Game to Be Here | Funny Video Gamer Humor Joke for Men Women Hat Cap  ","$16.99","613","4.8 out of 5 stars"
"21","SATINIOR","$19.99","558","4.3 out of 5 stars"
"22","Do Not Disturb Gaming Socks Novelty Gamer Hat Funny Unisex Socks Cap for Kid Teen Men Women Game Lovers  ","$14.99","137","4.5 out of 5 stars"
"23","Negi","$12.95","4","5.0 out of 5 stars"
"24","Snapback Hats for Men Black hat Flat Bill Men Blank Hats Trucker Cool lids Flat  ","$7.95","12,055","4.8 out of 5 stars"
"25","Yupoong","$9.99","902","4.8 out of 5 stars"
"26","Flexfit 6277 Wooly Combed Twill Cap … Black  ","$15.99","2,976","4.8 out of 5 stars"
"27","Popuid","$23.95","319","4.8 out of 5 stars"
"28","Novelty Do Not Disturb I'm Gaming Beanie Skull Cap & Socks Set, Funny Video Gamer Lovers Gaming Fathers Day  ","$25.99","3,244","4.6 out of 5 stars"
"29","Xpayzere","$16.99","15,533","4.5 out of 5 stars"
"30","I Paused My Game to Be Here Hat for Men Women，Funny Embroidered Adjustable Washed Cotton Gamer Baseball Cap  ","$17.99","63","4.3 out of 5 stars"
"31","NDLBS","$11.99","392","4.7 out of 5 stars"
"32","Easter Basket Stuffers for Teens, Do Not Disturb Im Gaming Hats,Gamer Gifts Cool Graduation Gifts for Teens Men Him  ","$24.99","236","4.5 out of 5 stars"
"33","Bioworld","$20.99","3,473","4.8 out of 5 stars"
"34","Sony Playstation Embroidered Logo Patch Gaming Icons Youth Flat Bill Hat Multicolored  ","$15.99","57","4.4 out of 5 stars"
"35","NPJY","$23.95","9,787","4.5 out of 5 stars"
"36","Baseball Cap Golf Dad Hat Adjustable Original Classic Low Profile Cotton Hat Unconstructed Plain Cap Men Women  ","$28.23","144","4.6 out of 5 stars"
"37","PopCrew","$15.60","515","4.3 out of 5 stars"
"38","Gaming Hats | Funny Video Gamer Gifts Accessories for Men Women Kids Teen Boys Hat Cap  ","$22.00","4","5.0 out of 5 stars"
"39","Bioworld","$26.98","1,160","4.6 out of 5 stars"
"40","Marvel Comic Logo Sublimated Bill Snapback Cap Hat Black  ","$24.74","60","4.8 out of 5 stars"
"41","alavisxf xx","$15.88","195","4.4 out of 5 stars"
"42","alavisxf xx LED Cap, Detachable LED Display Screen Smart Hat Adjustable Cool LED Baseball Cap for Party Christmas Halloween(Black)  ","$21.95","13","4.9 out of 5 stars"
"43","Enodtter","$25.95","5,238","4.8 out of 5 stars"
"44","Embroidered Baseball Hats for Men and Women  ","$15.99","91","4.7 out of 5 stars"
"45","Crazy Dog T-Shirts","$7.20","86","4.6 out of 5 stars"
"46","I Cant Adult Now Im Gaming Hat Funny Video Game Nerdy Cool Gamer Cap Funny Hats Funny Gamer Novelty Hats for Men Black - Standard  ","$12.00","1,615","4.6 out of 5 stars"
"47","Columbia","$17.99","104","4.6 out of 5 stars"
"48","PFG Mesh Canada Fish Flag Stretch-Fit Hat  ","$22.99",NA,"4 Stars & Up"
"49","Minecraft","$6.99",NA,"3 Stars & Up"
"50","Baseball Cap Diamond Boys Gamer Gifts Boys Teenagers Kids Snapback  ","$7.99",NA,"2 Stars & Up"
"51","GIGABYTE GeForce RTX 4060 Gaming OC 8G Graphics Card, 3X WINDFORCE Fans, 8GB 128-bit GDDR6, GV-N4060GAMING OC-8GD Video Card  ","$314.99","112","4.6 out of 5 stars"
"52","Hasbro Gaming Tiger Electronics Mighty Morphin Power Rangers Electronic LCD Video Game, Retro-Inspired Edition, Handheld 1-Player Game, Ages 8 and Up  ","$16.99","720","4.4 out of 5 stars"
"53","GIGABYTE GeForce RTX 4060 AERO OC 8G Graphics Card, 3X WINDFORCE Fans, 8GB 128-bit GDDR6, GV-N4060AERO OC-8GD Video Card  ","$324.99","93","4.9 out of 5 stars"
"54","Best Choice Products Swivel Gaming Chair 360 Degree Multipurpose Floor Chair Rocker for TV, Reading, Playing Video Games w/Lumbar Support, Armrest Handles, Adjustable Foldable Backrest - Black/Blue  ","$99.99","10,892","4.4 out of 5 stars"
"55","GIGABYTE GeForce RTX 3060 Gaming OC 12G (REV2.0) Graphics Card, 3X WINDFORCE Fans, 12GB 192-bit GDDR6, GV-N3060GAMING OC-12GD Video Card  ","$270.99","2,138","4.7 out of 5 stars"
"56","JBL Quantum 100 - Wired Over-Ear Gaming Headphones - Black, Large  ","$429.99","15,299","4.4 out of 5 stars"
"57","Meta Quest 2 — Advanced All-In-One Virtual Reality Headset — 128 GB  ","$39.95","70,166","4.7 out of 5 stars"
"58","Retro Gaming Console, Nostalgia Stick Game, Retro Video Game Console with Built-in 9 Emulators, 20,000+ Games, 4K HDMI Output, and 2.4GHz Wireless Controller for TV Plug and Play (64 G)  ","$249.00","16","3.2 out of 5 stars"
"59","Retro Game Console – Classic Mini Retro Game System Built-in 620 Games and 2 Controllers, Old-School Gaming System for Adults and Kids，8-Bit Video Game System with Classic Games  ","$39.99","49","3.7 out of 5 stars"
"60","VersionTECH. G2000 Gaming Headset for PS5 PS4 Xbox One Controller,Bass Surround Noise Cancelling Mic, Over Ear Headphones with LED Lights for Mac Laptop Xbox Series X S Nintendo Switch NES PC Games  ","$59.99","14,510","4.2 out of 5 stars"
"61","PlayStation 5 Console -  Marvel’s Spider-Man 2 Bundle (slim)  ","$19.99","2,596","4.7 out of 5 stars"
"62","Nintendo Switch™ with Neon Blue and Neon Red Joy‑Con™  ","$30.99","6,012","4.8 out of 5 stars"
"63","Retro Game Console – Classic Mini Retro Game System Built-in 620 Games and 2 Controllers, Old-School Gaming System for Adults and Kids，8-Bit Video Game System with Classic Games  ","$24.99","1","5.0 out of 5 stars"
"64","Gamer Neon Sign, Game Controller Neon Sign for Gamer Room Decor - Gaming Neon Sign for Teen Boy Room Decor, LED Game Neon Sign Gaming Wall decor - Best Gamer Gifts for Boys, Kids  ","$39.99","2,092","4.7 out of 5 stars"
"65","16 Bit Handheld Game Console for Kids Adults, 3.0'' Large Screen Preloaded 230 HD Classic Retro Video Games with USB Rechargeable Battery & 3 Game Cartridges for Birthday Gift for Kids 4-12  ","$284.99","1,232","4.1 out of 5 stars"
"66","Retro Game Console Built in 620 Video Games and 2 Controllers, Mini Video Game Console Plug and Play TV Games with AV Output, 8-Bit Video Game System with Classic Games,Children's Gift  ","$299.99","6","4.5 out of 5 stars"
"67","FUNTELL Wireless Retro Game Console, Plug & Play Video TV Game Stick with 15000+ Games Built-in, 64G, 9 Emulators, 4K HDMI Nostalgia Stick Game for TV, Dual 2.4G Wireless Controllers  ","$16.99","864","3.4 out of 5 stars"
"68","GTPLAYER Gaming Chair, Computer Chair with Footrest and Lumbar Support, Height Adjustable Game Chair with 360°-Swivel Seat and Headrest and for Office or Gaming (White)  ","$29.99","11,565","4.4 out of 5 stars"
"69","Do Not Disturb I'm Gaming Video Game Socks - Funny Gamer Gifts For Men and Women  ","$39.99","7","4.8 out of 5 stars"
"70","E-MODS GAMING Retro Games Console GV300S Mini TV Style 308 Video Games Player with Handheld Gamepad & AV Output - 3.0 Inch Screen Electronic Games Machine Xmas Gift for Kids Adults (Wood Grain)  ","$32.99","782","4.0 out of 5 stars"
"71","3-in-1 PC Gaming Headphone & Controller Holder - EURPMASK Headphones Hanger w/Adjustable & Rotating Arm Clamp,Headphone Stand Under Desk, Universal Headset Controllers Hook with Cable Organizer-Black  ","$39.99","27,056","4.7 out of 5 stars"
"72","Wireless Retro Gaming Console(64G), Plug & Play Video TV Game Stick with Built-in 9 Emulators, 20,000+ Video Games,4K HDMI Output, Revisit Classic Games with Dual 2.4G Wireless Controllers  ","$29.99","24","3.3 out of 5 stars"
"73","My Arcade Retro Machine Playable Mini Arcade: 200 Retro Style Games Built In, 5.75 Inch Tall, Powered by AA Batteries, 2.5 Inch Color Display, Speaker, Volume Control  ","$49.99","1,972","4.3 out of 5 stars"
"74","Handheld Game Console for Kids Aldults Preloaded 270 Classic Retro Games with 3.0'' Color Display and Gamepad Rechargeable Arcade Gaming Player (Black)  ","$99.90","1,541","3.8 out of 5 stars"
"75","Wireless Retro Game Console - Retro Play Game Stick,Nostalgia Stick Game,9 Classic Emulators,4K HDMI Output,Plug and Play Video Game Stick Built in 20000+ Games with 2.4G Wireless Controllers(64G)  ","$189.99","33","3.2 out of 5 stars"
"76","Old Arcade Retro Classic Game Console, 621 different classic games + bonus games, Save game play, HDMI Connection, classic game play, Retro Game Play, Nostalgic Game Play. Advanced Gaming solution  ","$6.99","862","4.0 out of 5 stars"
"77","Atari 2600+  ","$8.99","266","4.3 out of 5 stars"
"78","Handheld Game Console for Kids Preloaded 218 Retro Video Games, Portable Gaming Player with Rechargeable Battery 3.0"" LCD Screen, Mini Arcade Electronic Toy Gifts for Boys Girls, Blue  ","$32.99","246","4.3 out of 5 stars"
"79","Logitech G Cloud Handheld Portable Gaming Console with Long-Battery Life, 1080P 7-Inch Touchscreen, Lightweight Design, Xbox Cloud Gaming, NVIDIA GeForce NOW, Google Play  ","$19.94","1,162","4.3 out of 5 stars"
"80","Classic Mini Console 8-Bit Video Retro Game System Built-in with 777 Classic Old-School Games Dual Players Mode Console for Adults Kids Christmas/Birthday/Thanksgiving/Valentine Gift  ","$21.99","38","4.0 out of 5 stars"
"81","Retro Video Game Console,Stick Game,Wireless Retro Play Game Stick,Plug and Play Video Game Stick,4K HDMI Output,9 Classic Emulators,with Dual 2.4G Wireless Controllers(64G)  ","$45.97","2","4.5 out of 5 stars"
"82","Switch Controller, LED Star Wireless Pro Controller Compatible with Switch/Lite/OLED, Multi-Platform Windows PC/IOS/Android Controller with 9 Colors RGB Light/Programmabele/Vibration/Turbo/Wakeup  ","$49.97","479","4.7 out of 5 stars"
"83","Final Fantasy XVI - PlayStation 5  ","$31.50","1,260","4.6 out of 5 stars"
"84","Wireless Retro Game Console, Retro Game Stick, Nostalgia Stick Game, 20,000+ Games & 9 Emulators Built in, Plug and Play Video Games for Tv 4K HDMI, 2.4g Wireless Controllers (64G)  ","$32.98","27","2.3 out of 5 stars"
"85","FIFINE Gaming USB Microphone for PC PS5, Condenser Mic with Quick Mute, RGB Indicator, Tripod Stand, Pop Filter, Shock Mount, Gain Control for Streaming Discord Twitch Podcasts Videos- AmpliGame  ","$39.98","8,975","4.6 out of 5 stars"
"86","Walliebe Handheld Game Console 520 in 1 Preloaded Retro Video Games, Classic Retro Games - Crystal Press Buttons Rechargeable and Controller AV TV Output, Gift for Kids and Adults  ","$29.99","2","5.0 out of 5 stars"
"87","GIGABYTE GeForce RTX 4060 WINDFORCE OC 8G Graphics Card, 2X WINDFORCE Fans, 8GB 128-bit GDDR6, GV-N4060WF2OC-8GD Video Card  ","$59.98","78","4.7 out of 5 stars"
"88","PowerA Advantage Wired Controller for Xbox Series X|S and Windows 10/11 – Fortnite Midas, gamepad, wired video game controller, gaming controller, USB-C, Works with Xbox One, Officially Licensed, Bonus Virtual Item Included.  ","$54.98","267","4.3 out of 5 stars"
"89","Hyperkin RetroN 2 HD Gaming Console for NES/Super NES/Super Famicom (Gray)  ","$129.99","2,747","4.6 out of 5 stars"
"90","Switch Games Organizer Station with Controller Charger, Charging Dock for Nintendo Switch & OLED Joycons, Kytok Switch Storage and Organizer for Games, TV Dock, Pro Controller, Accessories Kit  ","$26.99","11","4.0 out of 5 stars"
"91","Upgrade Wireless Retro Game Console Stick, ZeroStory Retro Video Game Stick Built in 20000+ Games with 15 Emulators, 4K HDMI Output with 2 2.4G Wireless Controllers (64GB Memory Card)  ","$36.99","432","4.7 out of 5 stars"
"92","8BitDo Retro Mechanical Keyboard, Bluetooth/2.4G/USB-C Hot Swappable Gaming Keyboard with 87 Keys, Dual Super Programmable Buttons for Windows and Android - Fami Edition  ","$299.99","13,364","4.6 out of 5 stars"
"93","GANA Wii to HDMI Converter Adapter with Hdmi Cable Connect Wii Console to HDMI Display in 1080p Output Video with 3.5mm Audio Supports All Wii Display Modes White  ","$349.99","30,529","4.8 out of 5 stars"
"94","Fisher-Price Laugh & Learn Baby & Toddler Toy Game & Learn Controller Pretend Video Game with Music Lights & Activities Ages 6+ Months​  ","$23.99","24","4.5 out of 5 stars"
"95","GIGABYTE Radeon RX 7800 XT Gaming OC 16G Graphics Card, 3X WINDFORCE Fans 16GB 256-bit GDDR6, GV-R78XTGAMING OC-16GD Video Card  ","$27.99","1","5.0 out of 5 stars"
"96","Retro Game Console – Classic Mini Retro Game System Built-in 620 Games and 2 Controllers, Old-School Gaming System for Adults and Kids，8-Bit Video Game System with Classic Games  ","$36.99","31","3.7 out of 5 stars"
"97","Handheld Game Console for Kids, Retro Game Console Adults Large Screen Built-in 288 HD Electronic Games Portable Video Support Connecting TV with Battery 2 Game Cartridges for Birthday Gift  ","$42.59","28,223","4.7 out of 5 stars"
"98","I Paused My Game to Be Here | Funny Video Gamer Humor Joke for Men Women T-Shirt  ","$21.99",NA,"4 Stars & Up"
"99","GIGABYTE GeForce RTX 4060 Gaming OC 8G Graphics Card, 3X WINDFORCE Fans, 8GB 128-bit GDDR6, GV-N4060GAMING OC-8GD Video Card  ","$314.99","112","4.6 out of 5 stars"
"100","Hasbro Gaming Tiger Electronics Mighty Morphin Power Rangers Electronic LCD Video Game, Retro-Inspired Edition, Handheld 1-Player Game, Ages 8 and Up  ","$16.99","720","4.4 out of 5 stars"
